{
  "contract_name": "paper-intent-v1",
  "schema_version": "1.0.0",
  "producer_version": "1.0.0",
  "data_as_of": "2026-07-24T06:12:00Z",
  "created_at": "2026-07-24T06:20:00Z",
  "source_hashes": [
    {
      "source": "origin-proposal-and-sizing-decision",
      "sha256": "2020202020202020202020202020202020202020202020202020202020202020"
    }
  ],
  "intent_id": "paper-intent-000001",
  "origin_ref": {
    "contract_name": "evaluation-origin-v1",
    "artifact_id": "evaluation-origin-000001",
    "schema_version": "1.0.0",
    "sha256": "c9cbfad5eebcd7e46716020771d9ea2715b5ab178a745378304055a6aeb0787d",
    "created_at": "2026-07-24T06:15:00Z"
  },
  "proposal_ref": {
    "contract_name": "portfolio-proposal-v1",
    "artifact_id": "portfolio-proposal-20260724",
    "schema_version": "1.0.0",
    "sha256": "d096b62e8767f8ae5a345e537a2ec795e76379ffdfc6ab87ed87b4c24425057e",
    "created_at": "2026-07-24T03:22:00Z"
  },
  "sizing_decision_ref": {
    "contract_name": "sizing-decision-v1",
    "artifact_id": "sizing-decision-evaluator-origin-20260724t061200z-r1",
    "schema_version": "1.1.0",
    "sha256": "774aa31db0705f742caeb0ad07c54ce89f4c2624cb7c8cc55eb8867d7696da25",
    "created_at": "2026-07-24T06:13:00Z"
  },
  "branch_id": "PROPOSAL_BASE",
  "knowledge_cutoff": "2026-07-24T05:59:00Z",
  "recorded_at": "2026-07-24T06:20:00Z",
  "status": "RECORDED",
  "lines": [
    {
      "line_id": "paper-intent-line-000001",
      "asset_id": "XASX:BHP",
      "side": "BUY",
      "requested_quantity": "200",
      "requested_notional_aud": "10000.000000",
      "reference_price_aud": "50.000000",
      "sizing_line_id": "sizing-line-bhp-evaluator-origin-000001",
      "sizing_line_sha256": "3a1a05c6da7602496975a2d52be214d63c5296755af1a672e42e1953ca1c7eb5",
      "source_sha256": "f97a0dcb23c7f7de53e5d3e05a282e7e9a17f05241b3aae6455ba1b24448e172",
      "reason_codes": [
        "FROZEN_SIZING_DECISION"
      ]
    }
  ],
  "reason_codes": [
    "RECORDED_FROM_FROZEN_ORIGIN"
  ],
  "canonical_hash": {
    "canonicalization": "RFC8785",
    "hash_algorithm": "SHA-256",
    "excluded_json_pointer": "/canonical_hash/payload_sha256",
    "payload_sha256": "2c2b746632a4a677d9a63b8d5eeb763e71d3fca8ca197c49a668f43d995b0137"
  },
  "controls": {
    "evaluation_mode": "PAPER_ONLY",
    "is_order": false,
    "non_executable": true,
    "live_holdings_write": false
  }
}
